[
  {
    "schema_version": 1,
    "product": {
      "title": "Bliss Halloween Costume",
      "price": {
        "$type": "decimal",
        "value": "65.00"
      },
      "currency": "USD",
      "description": "No tricks, all treats when you dress like Bliss for Halloween! Get spa-ready with this iconic costume kit featuring everything you need to channel your inner\u00a0Bliss.",
      "image_url": "https://cdn.shopify.com/s/files/1/0702/9017/8333/files/BlissGirlCostumeContents.jpg?v=1791810489",
      "product_url": "https://www.blissworld.com/products/bliss-halloween-costume",
      "external_id": "15445253980445",
      "sku": "0585-0057003",
      "gtin": null,
      "mpn": null,
      "vendor": "Bliss World Store",
      "product_type": "",
      "in_stock": true,
      "condition": "NEW",
      "compare_at_price": null,
      "variants": [
        {
          "variant_id": "67743111872797",
          "title": "Default Title",
          "price": {
            "$type": "decimal",
            "value": "65.00"
          },
          "sku": "0585-0057003",
          "in_stock": true,
          "canonical_variant_id": "v_0d780491-b3e6-59ce-b075-0490a6df6ad9",
          "attributes": {
            "option1": "Default Title"
          },
          "gtin": null
        }
      ],
      "tags": [
        "refresh"
      ],
      "additional_images": [
        "https://cdn.shopify.com/s/files/1/0702/9017/8333/files/BlissGirlCostumeModel.jpg?v=1791810489",
        "https://cdn.shopify.com/s/files/1/0702/9017/8333/files/BlissGirlCostumeInPackage.png?v=1791810490"
      ],
      "category_path": [],
      "platform": "shopify",
      "scraped_at": {
        "$type": "datetime",
        "value": "2026-10-16T16:41:29.592849+00:00"
      },
      "raw_data": {},
      "canonical_product_id": "p_aa43b19b-909f-51b8-b8b8-7244e0598c11",
      "supplier_id": "www.blissworld.com",
      "attributes": {},
      "pack_quantity": null,
      "bundle_components": []
    },
    "evidence_contract": {
      "evidence": [
        {
          "evidence_id": "e_0e6dcdee-ca80-4dc9-9205-11c9c8da2792",
          "source_url": "https://www.blissworld.com/products.json?limit=2&page=1",
          "observed_at": {
            "$type": "datetime",
            "value": "2026-10-16T16:41:28.289364+00:00"
          },
          "method": "shopify_api",
          "excerpt": null,
          "retained_data": {
            "source_pointer": "/title",
            "value": "Bliss Halloween Costume"
          },
          "pointer": "/value",
          "source_role": "unverified",
          "truncated": false
        },
        {
          "evidence_id": "e_73d1fb39-c5bc-40b5-8f5d-626dc2ae8287",
          "source_url": "https://www.blissworld.com/products.json?limit=2&page=1",
          "observed_at": {
            "$type": "datetime",
            "value": "2026-10-16T16:41:28.289364+00:00"
          },
          "method": "shopify_api",
          "excerpt": null,
          "retained_data": {
            "source_pointer": "/variants/0/price",
            "value": "65.00"
          },
          "pointer": "/value",
          "source_role": "unverified",
          "truncated": false
        },
        {
          "evidence_id": "e_6dbe5ad8-9123-4549-b6d9-c3316e02f3d5",
          "source_url": "https://www.blissworld.com/products.json?limit=2&page=1",
          "observed_at": {
            "$type": "datetime",
            "value": "2026-10-16T16:41:28.289270+00:00"
          },
          "method": "shopify_response_cookie",
          "excerpt": null,
          "retained_data": {
            "source_pointer": "/cart_currency",
            "value": "USD"
          },
          "pointer": "/value",
          "source_role": "unverified",
          "truncated": false
        },
        {
          "evidence_id": "e_2a634d99-ea14-4cb0-af9b-33d5f86b4437",
          "source_url": "https://www.blissworld.com/products.json?limit=2&page=1",
          "observed_at": {
            "$type": "datetime",
            "value": "2026-10-16T16:41:28.289364+00:00"
          },
          "method": "shopify_api",
          "excerpt": null,
          "retained_data": {
            "source_pointer": "/body_html",
            "value": "<p data-pm-slice=\"1 1 []\"><meta charset=\"utf-8\"><span>No tricks, all treats when you dress like Bliss for Halloween! Get spa-ready with this iconic costume kit featuring everything you need to channel your inner\u00a0Bliss.</span></p>"
          },
          "pointer": "/value",
          "source_role": "unverified",
          "truncated": false
        },
        {
          "evidence_id": "e_ddb2f6ca-48a7-4c95-98a0-a69823f49410",
          "source_url": "https://www.blissworld.com/products.json?limit=2&page=1",
          "observed_at": {
            "$type": "datetime",
            "value": "2026-10-16T16:41:28.289364+00:00"
          },
          "method": "shopify_api",
          "excerpt": null,
          "retained_data": {
            "source_pointer": "/images/0/src",
            "value": "https://cdn.shopify.com/s/files/1/0702/9017/8333/files/BlissGirlCostumeContents.jpg?v=1791810489"
          },
          "pointer": "/value",
          "source_role": "unverified",
          "truncated": false
        },
        {
          "evidence_id": "e_e585d59d-4989-4b77-ba39-c2957eac20fa",
          "source_url": "https://www.blissworld.com/products.json?limit=2&page=1",
          "observed_at": {
            "$type": "datetime",
            "value": "2026-10-16T16:41:28.289364+00:00"
          },
          "method": "shopify_api",
          "excerpt": null,
          "retained_data": {
            "source_pointer": "/handle",
            "value": "bliss-halloween-costume"
          },
          "pointer": "/value",
          "source_role": "unverified",
          "truncated": false
        },
        {
          "evidence_id": "e_e141e49a-d621-49da-81ec-03886062e6c3",
          "source_url": "https://www.blissworld.com/products.json?limit=2&page=1",
          "observed_at": {
            "$type": "datetime",
            "value": "2026-10-16T16:41:28.289364+00:00"
          },
          "method": "shopify_api",
          "excerpt": null,
          "retained_data": {
            "source_pointer": "/id",
            "value": 15445253980445
          },
          "pointer": "/value",
          "source_role": "unverified",
          "truncated": false
        },
        {
          "evidence_id": "e_a56b54ba-ab27-4503-a298-eda0405b2614",
          "source_url": "https://www.blissworld.com/products.json?limit=2&page=1",
          "observed_at": {
            "$type": "datetime",
            "value": "2026-10-16T16:41:28.289364+00:00"
          },
          "method": "shopify_api",
          "excerpt": null,
          "retained_data": {
            "source_pointer": "/variants/0/sku",
            "value": "0585-0057003"
          },
          "pointer": "/value",
          "source_role": "unverified",
          "truncated": false
        },
        {
          "evidence_id": "e_1c4ab5c0-4c92-4ed3-a421-b2fb5e3a5139",
          "source_url": "https://www.blissworld.com/products.json?limit=2&page=1",
          "observed_at": {
            "$type": "datetime",
            "value": "2026-10-16T16:41:28.289364+00:00"
          },
          "method": "shopify_api",
          "excerpt": null,
          "retained_data": {
            "source_pointer": "/vendor",
            "value": "Bliss World Store"
          },
          "pointer": "/value",
          "source_role": "unverified",
          "truncated": false
        },
        {
          "evidence_id": "e_f9630cee-0cae-49af-9c1f-c423520084c3",
          "source_url": "https://www.blissworld.com/products.json?limit=2&page=1",
          "observed_at": {
            "$type": "datetime",
            "value": "2026-10-16T16:41:28.289364+00:00"
          },
          "method": "shopify_api",
          "excerpt": null,
          "retained_data": {
            "source_pointer": "/variants/0/available",
            "value": true
          },
          "pointer": "/value",
          "source_role": "unverified",
          "truncated": false
        },
        {
          "evidence_id": "e_05187087-5807-4413-aeca-452494753659",
          "source_url": "https://www.blissworld.com/products.json?limit=2&page=1",
          "observed_at": {
            "$type": "datetime",
            "value": "2026-10-16T16:41:28.289364+00:00"
          },
          "method": "shopify_api",
          "excerpt": null,
          "retained_data": {
            "source_pointer": "/variants",
            "value": [
              {
                "id": 67743111872797,
                "title": "Default Title",
                "option1": "Default Title",
                "option2": null,
                "option3": null,
                "sku": "0585-0057003",
                "requires_shipping": true,
                "taxable": true,
                "featured_image": null,
                "available": true,
                "price": "65.00",
                "grams": 363,
                "compare_at_price": null,
                "position": 1,
                "product_id": 15445253980445,
                "created_at": "2026-10-12T08:53:45-04:00",
                "updated_at": "2026-10-16T12:41:28-04:00"
              }
            ]
          },
          "pointer": "/value",
          "source_role": "unverified",
          "truncated": false
        },
        {
          "evidence_id": "e_48193524-bd1b-4902-ab10-3440cb6a5e43",
          "source_url": "https://www.blissworld.com/products.json?limit=2&page=1",
          "observed_at": {
            "$type": "datetime",
            "value": "2026-10-16T16:41:28.289364+00:00"
          },
          "method": "shopify_api",
          "excerpt": null,
          "retained_data": {
            "source_pointer": "/variants/0/id",
            "value": 67743111872797
          },